序号,代码,名称,最新价(元) 10:28,涨跌幅(%) 10:28,证券类型,成交额(元) 10:28,申万行业分类,股票简称,东财行业总分类,概念,涨跌额(元) 10:28,最高价(元) 10:28,最低价(元) 10:28,换手率(%) 10:28,量比 10:28,成交量(股) 10:28,市盈率(动)(倍) 2026.07.10,市净率(倍) 2026.07.10,总市值(元) 2026.07.10,流通市值(元) 2026.07.10
1,301583,N托伦斯,241.24,967.43,A股,38.45亿,电子-半导体-半导体设备,托伦斯,电子-半导体-半导体设备,国产芯片、融资融券、创业板综、半导体概念,218.640,264.42,203.40,52.47,0.00,1617.77万,763.23,24.1538,446.99亿,74.30亿
2,920081,N欧伦,51.39,32.83,A股,4.65亿,家用电器-小家电-清洁小家电,欧伦电气,家用电器-小家电-清洁小家电,融资融券、贬值受益,12.700,58.88,49.02,50.77,0.00,868.17万,15.55,2.3359,37.31亿,8.79亿
3,920267,鑫汇科,18.14,29.94,A股,9484.34万,电子-消费电子-消费电子零部件及组装,鑫汇科,电子-消费电子-消费电子零部件及组装,国产芯片、跨境电商、专精特新、融资融券、智能家居、海峡两岸、MCU芯片、半导体概念、深圳特区、超跌股,4.180,18.14,13.97,20.20,35.83,549.05万,-60.43,3.5716,8.61亿,4.93亿
4,688238,和元生物,6.90,20.00,A股,2.94亿,医药生物-医疗服务-医疗研发外包,和元生物,医药生物-医疗服务-医疗研发外包,CAR-T细胞疗法、CRO、细胞免疫治疗、创新医疗服务、专精特新、融资融券、免疫治疗、破发股、人工智能、重组蛋白、智能医疗、基因测序、上海自贸,1.150,6.90,5.80,6.91,6.51,4431.83万,-21.09,3.3033,44.78亿,44.24亿
5,688328,深科达,122.41,19.99,A股,16.07亿,机械设备-专用设备-其他专用设备,深科达,机械设备-专用设备-其他专用设备,国产芯片、专精特新、电子纸概念、昨日高振幅、新能源车、光通信模块、第三代半导体、存储芯片、深圳特区、柔性屏、新型工业化、华为概念、小米概念、最近多板、消费电子概念、智能穿戴、CPO概念、OLED、混合现实、机器人概念、融资融券、2025年报扭亏、AI眼镜、显示技术、昨日首板、虚拟现实、半导体概念、先进封装、机器视觉、锂电池概念、先进封装设备、机器人执行器、MiniLED,20.390,122.42,112.11,14.19,6.19,1339.93万,106.79,13.7516,115.62亿,115.62亿
6,300786,国林科技,23.90,19.98,A股,2.04亿,环保-环保设备Ⅱ-环保设备Ⅲ,国林科技,环保-环保设备Ⅱ-环保设备Ⅲ,国产芯片、专精特新、医废处理、海工装备、新疆振兴、节能环保、存储芯片、污水处理、中俄贸易概念、光刻机/胶、OLED、雄安新区、医疗器械概念、商业航天、净水概念、半导体概念、先进封装、氢能源、光伏概念、新材料、空气能热泵、煤化工概念、HJT电池、创业板综、先进封装设备、冷链物流,3.980,23.90,20.20,6.11,3.32,894.88万,227.60,3.9327,43.98亿,34.99亿
7,300071,福石控股,4.94,19.90,A股,11.22亿,传媒-广告营销-营销代理,福石控股,传媒-广告营销-营销代理,多模态AI、昨日高振幅、数字经济、元宇宙概念、抖音概念、华为概念、小红书概念、昨日高换手、腾讯概念、京津冀一体化、AI应用、百度概念、DeepSeek概念、人工智能、AI语料、Sora概念、数据要素、深股通、AIGC概念、昨日触板、ChatGPT概念、Web3.0、虚拟数字人、比亚迪概念、创业板综、昨日炸板,0.820,4.94,4.04,25.88,7.64,2.45亿,-1799.50,29.5804,47.62亿,46.70亿
8,300255,常山药业,26.09,18.86,A股,13.21亿,医药生物-化学制药-化学制剂,常山药业,医药生物-化学制药-化学制剂,中盘股、雄安新区、融资融券、深股通、医美概念、零售概念、特色药、新消费、深成500、肝素概念、医药医疗风格、化妆品概念、创业板综、减肥药、创新药、MSCI中国、超跌股,4.140,26.34,21.43,5.81,5.45,5332.76万,1021.44,19.8220,239.87亿,239.50亿
9,300105,龙源技术,8.21,18.81,A股,4.62亿,环保-环保设备Ⅱ-环保设备Ⅲ,龙源技术,电力设备-其他电源设备Ⅱ-火电设备,雄安新区、破发股、超超临界发电、节能环保、碳交易、华为概念、光伏概念、固废处理、2025三季报预增、储能概念、央国企改革、DeepSeek概念、PM2.5、创业板综、风能、碳中和,1.300,8.29,6.82,11.30,8.16,5824.67万,87.19,2.3692,42.40亿,42.37亿
10,688101,三达膜,17.94,16.80,A股,1.99亿,环保-环境治理-水务及水治理,三达膜,环保-环境治理-水务及水治理,福建自贸区、融资融券、西部大开发、破发股、净水概念、沪股通、节能环保、核污染防治、污水处理、新材料、锂电池概念、盐湖提锂、石墨烯、海峡两岸、隔膜、代糖概念,2.580,18.43,15.62,3.39,15.93,1125.30万,15.12,1.3292,59.56亿,59.56亿
11,688726,拉普拉斯,51.90,16.45,A股,5.70亿,电力设备-光伏设备-光伏加工设备,拉普拉斯,电力设备-光伏设备-光伏加工设备,国产芯片、BC电池、专精特新、融资融券、钙钛矿电池、注册制次新股、第三代半导体、沪股通、半导体概念、先进封装、TOPCON电池、光伏概念、小盘股、比亚迪概念、小盘成长、TOPCon电池,7.330,52.10,45.00,5.24,6.38,1153.15万,43.63,5.1459,210.16亿,114.03亿
12,300487,蓝晓科技,82.38,16.06,A股,13.77亿,基础化工-塑料-合成树脂,蓝晓科技,基础化工-塑料-合成树脂,国产芯片、专精特新、中盘股、西部大开发、转债标的、金属钴、存储芯片、深成500、节能环保、生物疫苗、趋势股、固废处理、盐湖提锂、工业大麻、小金属概念、MSCI中国、融资融券、原料耗材、深股通、中盘成长、中证500、养老金、净水概念、金属回收、半导体概念、碳交易、核污染防治、金属镍、第四代半导体、新材料、锂电池概念、比亚迪概念、创业板综、减肥药、锂矿概念、碳中和,11.400,83.90,74.35,5.57,4.96,1716.61万,57.60,9.6014,419.12亿,253.56亿
13,301117,佳缘科技,19.50,15.32,A股,4.27亿,计算机-计算机设备-安防设备,佳缘科技,计算机-计算机设备-安防设备,国产芯片、DRG/DIP、区块链、东数西算、西部大开发、数字经济、AI智能体、华为概念、军民融合、华为昇腾、DeepSeek概念、人工智能、互联医疗、军工、数据安全、智慧政务、军工信息化、安防概念、创新医疗服务、融资融券、移动支付、深股通、卫星测控、破发股、商业航天、网络安全、数据中心、国产软件、卫星导航、创业板综、汽车芯片、AI军工、智能医疗,2.590,19.85,15.86,20.96,19.07,2428.08万,-36.54,2.8517,35.34亿,22.64亿
14,300184,力源信息,17.88,14.76,A股,23.85亿,电子-其他电子Ⅱ-其他电子Ⅲ,力源信息,电子-其他电子Ⅱ-其他电子Ⅲ,国产芯片、长江存储、存储芯片、AI芯片、智能穿戴、腾讯概念、电力物联网、独角兽、OLED、富时罗素、MLCC、物联网、机器人概念、内贸流通、华为海思、融资融券、液冷概念、商业航天、半导体概念、芯片分销、小盘价值、PCB、数据中心、电商概念、光伏概念、长鑫存储、星闪概念、智能电网、汽车芯片、无线耳机、5G概念、元宇宙概念、车联网、第三代半导体、华为概念、小米概念、通信技术、消费电子概念、跨境电商、智能家居、人工智能、MCU芯片、2025年报预增、电网概念、6G概念、深股通、UWB概念、小盘股、ETC、比亚迪概念、创业板综、传感器、汽车电子、特斯拉概念,2.300,18.30,15.58,13.04,6.55,1.37亿,37.40,4.8745,205.45亿,188.10亿
15,688660,电气风电,9.00,14.21,A股,1.63亿,电力设备-风电设备-风电整机,电气风电,电力设备-风电设备-风电整机,小盘股、融资融券、海工装备、央国企改革、齿轮箱、小盘成长、沪股通、风能、沪企改革、新能源,1.120,9.00,7.81,1.46,4.27,1943.39万,-11.11,3.0944,120.00亿,120.00亿
16,301317,鑫磊股份,65.60,14.11,A股,3.61亿,机械设备-通用设备-其他通用设备,鑫磊股份,机械设备-通用设备-其他通用设备,专精特新、融资融券、共同富裕示范区、昨日高振幅、液冷概念、深股通、新能源车、磁悬浮压缩机、昨日触板、数据中心、昨日高换手、污水处理、空气能热泵、中俄贸易概念、创业板综、昨日炸板、人工智能、2025年报预增,8.110,65.60,56.92,11.19,3.64,583.83万,-132.45,8.7112,102.87亿,34.16亿
17,300911,亿田智能,22.19,13.79,A股,2.38亿,家用电器-厨卫电器-厨房电器,亿田智能,家用电器-厨卫电器-厨房电器,东数西算、融资融券、深股通、算力概念、转债标的、AIGC概念、腾讯概念、算力租赁、DeepSeek概念、创业板综、人工智能、阿里概念、超跌股,2.690,22.59,19.43,6.54,7.40,1120.87万,-28.73,3.7535,40.68亿,38.02亿
18,688584,上海合晶,45.70,13.48,A股,15.72亿,电子-半导体-半导体材料,上海合晶,电子-半导体-半导体材料,题材股、国产芯片、专精特新、融资融券、昨日高振幅、昨日首板、贬值受益、沪股通、半导体概念、最近多板、东方财富热股、小盘股、趋势股、半导体硅片,5.430,48.32,44.00,9.88,4.98,3392.81万,609.18,7.3494,305.82亿,156.89亿
19,301326,捷邦科技,144.60,13.23,A股,3.41亿,电子-消费电子-消费电子零部件及组装,捷邦科技,电子-消费电子-消费电子零部件及组装,国产芯片、融资融券、液冷概念、碳基材料、深股通、贬值受益、无人机、养老金、3D打印、苹果概念、宁德时代概念、电池技术、消费电子概念、固态电池、新材料、锂电池概念、比亚迪概念、3D打印设备、创业板综、富士康概念,16.900,151.01,138.51,3.25,7.09,234.55万,-176.04,8.5137,105.14亿,104.22亿
20,920227,美登科技,53.67,13.18,A股,4011.82万,计算机-IT服务Ⅱ-IT服务Ⅲ,美登科技,计算机-IT服务Ⅱ-IT服务Ⅲ,互联网服务、电商概念、融资融券、拼多多概念、AI应用、虚拟现实、抖音概念、ERP概念、快手概念、阿里概念、小红书概念,6.250,53.76,45.88,4.48,7.88,79.42万,44.90,5.3524,20.84亿,9.48亿
